{
  "schemaVersion": 2,
  "id": "link-accent-pack",
  "name": "Link Accent Pack",
  "version": "1.0.0",
  "entry": null,
  "pluginType": "ui-snippet",
  "capabilities": [
    "theme.snippet"
  ],
  "platforms": [
    "desktop",
    "web"
  ],
  "requiresRestart": false,
  "experimental": false,
  "minAppVersion": "0.6.0",
  "maxAppVersion": null,
  "permissions": {
    "theme": {
      "register": true
    }
  },
  "contributes": {
    "theme": {
      "style": [],
      "snippets": [
        {
          "file": "theme/snippets/link-accent-pack.css",
          "id": "link-accent-pack",
          "label": "Link Accent",
          "description": "Stronger underline on inline wiki links.",
          "defaultEnabled": false
        }
      ],
      "tokens": [],
      "defaultEnable": {}
    },
    "commands": [],
    "preferencesSections": [],
    "panels": []
  }
}
