{
  "schemaVersion": 2,
  "id": "sakura-breeze-pack",
  "name": "Sakura Breeze Pack",
  "version": "1.0.0",
  "entry": null,
  "pluginType": "theme-pack",
  "capabilities": [
    "theme.style"
  ],
  "platforms": [
    "desktop",
    "web"
  ],
  "requiresRestart": false,
  "experimental": false,
  "minAppVersion": "0.6.0",
  "maxAppVersion": null,
  "permissions": {
    "theme": {
      "register": true
    }
  },
  "contributes": {
    "theme": {
      "style": [
        {
          "file": "theme/style/sakura-breeze-pack.css",
          "label": "Sakura Breeze",
          "description": "Gentle sakura palette with rounded inline code styling."
        }
      ],
      "snippets": [],
      "tokens": [],
      "defaultEnable": {
        "style": false
      }
    },
    "commands": [],
    "preferencesSections": [],
    "panels": []
  }
}
