{
  "schemaVersion": 2,
  "id": "graphite-noir-pack",
  "name": "Graphite Noir Pack",
  "version": "1.0.0",
  "entry": null,
  "pluginType": "theme-pack",
  "capabilities": [
    "theme.token"
  ],
  "platforms": [
    "desktop",
    "web"
  ],
  "requiresRestart": false,
  "experimental": false,
  "minAppVersion": "0.6.0",
  "maxAppVersion": null,
  "permissions": {
    "theme": {
      "register": true
    }
  },
  "contributes": {
    "theme": {
      "style": [],
      "snippets": [],
      "tokens": [
        {
          "file": "theme/tokens/graphite-noir-pack.json",
          "label": "Graphite Noir Tokens",
          "description": "Dark JSON token preset — pair with any external CSS or built-in preset."
        }
      ],
      "defaultEnable": {}
    },
    "commands": [],
    "preferencesSections": [],
    "panels": []
  }
}
