{
  "schemaVersion": 2,
  "id": "serif-headings-pack",
  "name": "Serif Headings Pack",
  "version": "1.0.0",
  "entry": null,
  "pluginType": "ui-snippet",
  "capabilities": [
    "theme.snippet"
  ],
  "platforms": [
    "desktop",
    "web"
  ],
  "requiresRestart": false,
  "experimental": false,
  "minAppVersion": "0.6.0",
  "maxAppVersion": null,
  "permissions": {
    "theme": {
      "register": true
    }
  },
  "contributes": {
    "theme": {
      "style": [],
      "snippets": [
        {
          "file": "theme/snippets/serif-headings-pack.css",
          "id": "serif-headings-pack",
          "label": "Serif Headings",
          "description": "Serif h1–h2 via NodeView heading selectors.",
          "defaultEnabled": false
        }
      ],
      "tokens": [],
      "defaultEnable": {}
    },
    "commands": [],
    "preferencesSections": [],
    "panels": []
  }
}
